{
  "sourcePath": "raw-input/age-of-decadence",
  "generatedAt": "2025-10-21T12:00:00Z",
  "project": "age-of-decadence",
  "projectDisplayName": "Age of Decadence",
  "inputHash": "aaaaaaaaaaaaaaaaaaaaaaaaaaaaaaaaaaaaaaaaaaaaaaaaaaaaaaaaaaaaaaaa",
  "segments": [
    {
      "id": "text10",
      "text": "Meru's pilgrimage to the Holy Al-Akia...",
      "isEmpty": false,
      "lineNumber": 1
    }
  ]
}


