{
  "sourcePath": "raw-input/pathologic2-marble-nest/english.txt",
  "generatedAt": "2025-10-21T12:00:00Z",
  "project": "pathologic2-marble-nest",
  "projectDisplayName": "Pathologic 2: Marble Nest",
  "inputHash": "8f4c3d9e8f4c3d9e8f4c3d9e8f4c3d9e8f4c3d9e8f4c3d9e8f4c3d9e8f4c3d9e",
  "segments": [
    {
      "id": "conv:6192355001750781",
      "text": "Executor: The stage is set.",
      "isEmpty": false,
      "lineNumber": 1,
      "metadata": {
        "category": "dialogue",
        "scene": "theatre_farewell",
        "speaker": "Executor"
      }
    },
    {
      "id": "conv:6192355001750784",
      "text": "Bachelor: I won't bow.",
      "isEmpty": false,
      "lineNumber": 2,
      "metadata": {
        "category": "dialogue",
        "scene": "theatre_farewell",
        "speaker": "Bachelor"
      }
    }
  ]
}


